{
  "schema_version": "controlled-contract-admitted-proof-pack.v1",
  "profile_id": "proof.state.bounded-interval-nonmutation",
  "profile_version": "1.0.0",
  "profile_digest": "2e6bf0d0f1c6235e3fa4b82d4999125fc8d7f55450f5c94d18a2eb6e7a9b40fc",
  "guarantee": "For one caller-declared actor or process, one declared interval with distinct ordered start and end events, and one complete exact nonempty protected-resource population, the actor neither writes nor mutates any protected member during that interval; same-actor, same-population, same-interval positive write and mutation propositions falsify the plan, including mutate then restore.",
  "guarantee_digest": "939c6810e54a1ca2b6174e13bdd12bebec13f923159f57cd7ee6c752b4e42fee",
  "explicit_exclusions": [
    "actions-outside-the-declared-interval",
    "delete-or-create-unless-represented-as-write-or-mutation",
    "dishonest-identities-populations-intervals-or-grounding",
    "real-time-clock-trace-or-evidence-truth",
    "trace-omissions-or-unreported-transient-activity",
    "undiscovered-actors-or-protected-resources"
  ],
  "certification": {
    "method": "executable_adequacy_full_negative_corpus",
    "adequacy_declaration_digest": "2d5a63c2b2953cca059d0dd5f95e385ecd7e4ce1d0b21a7fab573b1e268d93db",
    "adequacy_result_digest": "65d8201ec0ccacf79a43ea7cced0d2a90245d7786e2114e2e28b471883b2e967",
    "executable_control_count": 29,
    "negative_fixture_count": 3,
    "coverage_witness_count": 58
  }
}
