{
  "schema_version": "controlled-contract-admitted-proof-pack.v1",
  "profile_id": "proof.readiness.before-success",
  "profile_version": "3.0.0",
  "profile_digest": "87260238247a5bcd20e01db8fd07f84b078e4094574126635c2a9d70e812321f",
  "guarantee": "One grounded capability initialized by one attempt is exercised by a distinct readiness operation after initialization; the readiness result accepts the probe and its observed complete state equals a criterion-conforming expected ready state; and the declared completion report does not precede that readiness result.",
  "guarantee_digest": "c9482f026f92212d71a5c1674efd1de475659c8957bfc71db33bc1217ac08d58",
  "explicit_exclusions": [
    "concurrent-readiness-transitions",
    "continued-usability-after-completion",
    "identity-existence-beyond-kind",
    "initialization-failure-cleanup",
    "pack-applicability",
    "readiness-operation-completeness",
    "regression-after-successful-probe"
  ],
  "certification": {
    "method": "executable_adequacy_full_negative_corpus",
    "adequacy_declaration_digest": "ee41e0af60228702c4980af580b2fc0064595705c5fa7ae47e7cb864c28c4c29",
    "adequacy_result_digest": "20f45d36703e6964d0aa83df48cfdd997786532cbce23e10d7091158a112fd7c",
    "executable_control_count": 58,
    "negative_fixture_count": 123,
    "coverage_witness_count": 123
  }
}
