{
  "schema_version": "controlled-contract-admitted-proof-pack.v1",
  "profile_id": "proof.result-shape.cross-representation-parity",
  "profile_version": "1.0.0",
  "profile_digest": "d1cab77b4b01d01c127865ec21f6b8454e3644669f78f4b8d5d18a72a5a17879",
  "guarantee": "For one declared logical source, two distinct result surfaces expose equal complete populations of typed member descriptors by mutual subset, bind one shared exact nonnegative member count, emit count signals equal to that count, and expose one explicitly selected canonical value pair that is exactly equal. One verification reads both full representations and each verified behavior has its controlled complement as a separate falsifier.",
  "guarantee_digest": "dbdd109fc9962e1d632ad0dde104123ccbf2a37d79c402d77f7eb5f1f0b0635e",
  "explicit_exclusions": [
    "applicability-selection",
    "automatic-or-arbitrary-multi-value-pairing",
    "business-semantics-referential-integrity-and-cross-member-invariants",
    "caller-authored-population-truthfulness-and-completeness",
    "delivered-test-implementation-and-result-value-authenticity",
    "field-name-or-schema-mapping",
    "independent-schema-truthfulness-or-compatibility",
    "logical-source-provenance",
    "nested-recursive-value-parity",
    "ordering-transport-media-type-pagination-and-streaming-parity",
    "type-coercion-normalization-unit-conversion-rounding-or-timezone-conversion",
    "typed-member-descriptor-authoritative-construction-or-existence"
  ],
  "certification": {
    "method": "executable_adequacy_full_negative_corpus",
    "adequacy_declaration_digest": "cf9c4632fd0d1af5e01719ae523e6f66ccf464c179a37666128743048a94cc29",
    "adequacy_result_digest": "606c7b0c7d53c4395b0b55e3c637d290926f29bd90e780449d9968c16bd48111",
    "executable_control_count": 40,
    "negative_fixture_count": 87,
    "coverage_witness_count": 87
  }
}
