{
  "schema_version": "controlled-contract-admitted-proof-pack.v1",
  "profile_id": "proof.concurrency.single-winner-effect",
  "profile_version": "2.0.0",
  "profile_digest": "9b3252412735e49132470172118145841b80a59f2a878ee599386a6e599c6bb5",
  "guarantee": "Exactly two distinct attempts for one grounded operation and scoped key overlap because both starts precede both terminal events; one elected winner is accepted and creates the sole member of the complete effect population, one elected loser is rejected and creates no such effect, and post-terminal observations read the elected durable resource with loser state equal to winner state.",
  "guarantee_digest": "defcedac8d42c9dde51822e911be1f334993db004b4bb9f174e6b0f1ddc38e4c",
  "explicit_exclusions": [
    "arbitrary-histories-beyond-two-attempts",
    "hidden-or-out-of-population-effects",
    "runtime-clock-or-event-order-truth",
    "runtime-grounding-or-trace-truth",
    "transient-duplicate-and-restore"
  ],
  "certification": {
    "method": "executable_adequacy_full_negative_corpus",
    "adequacy_declaration_digest": "9eb13cae2b55f988a6ba2c57ec9e5ccf298d2111f027a3ecc74cf353ebb61528",
    "adequacy_result_digest": "5f2f2849be2366657395e1b1be7705fa54288b9428b24574206b9210bb21f94b",
    "executable_control_count": 36,
    "negative_fixture_count": 3,
    "coverage_witness_count": 178
  }
}
