{
  "schema_version": "controlled-contract-admitted-proof-pack.v1",
  "profile_id": "proof.design.implementation-readiness",
  "profile_version": "3.0.0",
  "profile_digest": "f2bc560180b7f84d6f4e63ecac56e5bc04a4dd55986cb199ccd9a2e5d9476575",
  "guarantee": "One authored design unit names independently bound repository-grounded implementation and test loci; declares a complete nonempty requirement population, an exact four-field warning shape with exact code, severity, message-template, and payload-schema values, an authored complete validation population equal to the requirement population, and a complete placeholder population with exact count zero.",
  "guarantee_digest": "4a2c1a5cfc099cfecef4b0983db5bb81b941ddcfb5dcddfae7d23fd0437c228c",
  "explicit_exclusions": [
    "authored-population-truth",
    "grounded-identity-existence",
    "omitted-authored-requirement",
    "product-sufficiency",
    "runtime-and-repository-truth",
    "warning-runtime-execution"
  ],
  "certification": {
    "method": "executable_adequacy_full_negative_corpus",
    "adequacy_declaration_digest": "b211b1a092805acf1079ff632e229437424160039025cf5b690b1c0b0c03b98b",
    "adequacy_result_digest": "84455a531f5c613b3b92f9edfc5e55953d73d69083c37cdbeb82010b725be73e",
    "executable_control_count": 32,
    "negative_fixture_count": 99,
    "coverage_witness_count": 99
  }
}
