{
  "schema_version": "controlled-contract-admitted-proof-pack.v1",
  "profile_id": "proof.completeness.lossless-projection",
  "profile_version": "1.0.0",
  "profile_digest": "d9aa8d2971bc1415658800590039de3cec8b89571c7a73273427c21b17108ec9",
  "guarantee": "When one declared structured tool exposes one compact mode and one distinct documented complete mode, the declared compact result omits at least one declared heavy member; every declared omission is absent from the compact population, present in the complete-result population, represented in an omission population whose computed union with the compact population equals the complete source population, and represented in a disclosed population equal to the omission population; the complete-result population equals the source population; the compact result names the complete mode and carries the disclosure, complete total, and omission total; both totals equal the corresponding exact bound population cardinalities; and the selected omission reason is a member of a closed declared reason catalog.",
  "guarantee_digest": "e999fd999699e6b4f0ce98b59622c11ee30a74f0f6ce150c18a7bb0a9c887a80",
  "explicit_exclusions": [
    "authored-population-truthfulness",
    "code-routing-and-call-graph",
    "cross-storage-envelope-parity",
    "delivered-test-implementation",
    "identity-provenance-truthfulness",
    "member-byte-value-equality",
    "modes-outside-bound-pair",
    "pagination-range-and-cursor-semantics",
    "redaction-and-security-exemptions"
  ],
  "certification": {
    "method": "executable_adequacy_full_negative_corpus",
    "adequacy_declaration_digest": "40e737d07201e354e2afe78cf2020cfe6bf58b0538b6b055b7ae98f305c949bc",
    "adequacy_result_digest": "c1b6418de2ced8d861bf592c117c446f2ca9fabdce72e056ea86483ddfe3af9f",
    "executable_control_count": 35,
    "negative_fixture_count": 10,
    "coverage_witness_count": 179
  }
}
