{
  "schema_version": "controlled-contract-admitted-proof-pack.v1",
  "profile_id": "proof.verification.test-validity",
  "profile_version": "2.0.0",
  "profile_digest": "59527097c062083176952aba5764b545d4ae99134a1e3985eddd3cd5b5e11129",
  "guarantee": "For every stable-v1 test_execution verification, one exact test-proof binding and one execution witness establish exact versioned launcher-registry provider bindings and capability-snapshot evidence for candidate execution, every falsifier, and traversal; launcher-owned Node test structured events and content-addressed artifacts that ignore test-controlled output; identity-matched system-under-test traversal observed through launcher-owned V8 coverage and an exact node_test_structured_assertion observation seam; a complete unchanged candidate pass; isolated execution of every discriminating launcher-applied module-substitution falsifier against its declared proposition with its exact strategy-bound structured failure reason; exactly one declared test, the one the binding's declarative test selector names, present in the launcher-observed inventory and passed rather than skipped or failed, with sibling tests observed in the same run neither substituting for it nor counting against it and no authored baseline inventory participating; and no prohibited source-text inspection or caller-injected executor. Unsupported traversal is registry-authenticated and remains review_only. Mechanical evaluation does not determine whether the coordinator selected the semantically correct boundary, observable, falsifiers, test selector, or provider.",
  "guarantee_digest": "9b0750f485dea8b2ac48d3b55e88431cc9f81d102da63ea3126a77081386fe40",
  "explicit_exclusions": [
    "authority-grant",
    "coordinator-semantic-judgment",
    "delivered-runtime-truth",
    "provider-support-invention"
  ],
  "certification": {
    "method": "executable_adequacy_full_negative_corpus",
    "adequacy_declaration_digest": "8de9df56ecb7f5ff5e48a3bc2fbdb093c42dba98a9bc73fa69a32d593e15af42",
    "adequacy_result_digest": "58b6bf2e7ea2874496b73658b087e5737001104d972de980054cefb567954ab4",
    "executable_control_count": 41,
    "negative_fixture_count": 39,
    "coverage_witness_count": 39
  }
}
