{
  "schema_version": "controlled-contract-admitted-proof-pack.v1",
  "profile_id": "proof.ownership.fenced-handoff",
  "profile_version": "2.0.0",
  "profile_digest": "6152a5d5a987696289834f1df0fc9de128d0909d9b0ad38ac5f390b4870b42c7",
  "guarantee": "For one declared resource and fence, complete declared predecessor attempt and effect populations precede the fence under one predecessor authority and epoch; successor activation and complete declared successor attempt and effect populations follow the fence under one distinct successor authority and epoch; every complete declared post-fence predecessor attempt is refused and writes or mutates no declared protected resource; the complete post-fence predecessor protected-effect and dual-active observation populations are empty; and distinct observations ordered around the fence record the corresponding predecessor and successor authority, epoch, and resource.",
  "guarantee_digest": "68c788f79b75254bb8600eb8805fb8bf6589052825cc26b243f482261641f975",
  "explicit_exclusions": [
    "delivered-evidence-authenticity-or-plan-implementation",
    "dishonest-authority-epoch-resource-fence-attempt-effect-and-observation-grounding",
    "distributed-clock-agreement-or-a-total-order-beyond-the-declared-graph",
    "liveness-eventual-takeover-or-bounded-handoff-duration",
    "repeated-nested-or-unbounded-ownership-histories",
    "runtime-events-actors-resources-and-effects-outside-declared-populations",
    "wall-clock-or-real-time-truth"
  ],
  "certification": {
    "method": "executable_adequacy_full_negative_corpus",
    "adequacy_declaration_digest": "5be1d46e69e9677a12d941b7c7d45dad6fca4a409bfc6c4d1e3b26d9f3f9aea2",
    "adequacy_result_digest": "7e34d6d40d2f319de401b64271f046f9decc014641691ff1f39e1d496ac9b304",
    "executable_control_count": 26,
    "negative_fixture_count": 218,
    "coverage_witness_count": 218
  }
}
