{
  "schema_version": "controlled-contract-admitted-proof-pack.v1",
  "profile_id": "proof.cancellation.isolation",
  "profile_version": "1.0.0",
  "profile_digest": "2e5869f940bccdf63572b277ecc40541b7b3073292d70f0733fe1c07bd264e28",
  "guarantee": "Two distinct grounded generations are exercised by two distinct grounded attempts of one grounded operation before a grounded cancellation operation targets one generation; after its cancellation result establishes that generation's criterion-conforming cancelled state, the other generation's selected resource state and authority remain preserved and that other attempt later produces a successful result equal to its criterion-conforming expected state.",
  "guarantee_digest": "20b89764350b8a5bd1a4c04f0ef63b2a648b72619515aa4fb174ce6d7e03b109",
  "explicit_exclusions": [
    "authority-beyond-selected-surviving-authority",
    "cancellation-propagation-outside-elected-generations",
    "concurrent-interleavings-and-linearizability",
    "delivered-evidence-authenticity",
    "identity-existence-beyond-grounding-kind",
    "pack-applicability",
    "resources-outside-selected-protected-resource",
    "subsequent-results-after-elected-success",
    "transient-interference-between-observations"
  ],
  "certification": {
    "method": "executable_adequacy_full_negative_corpus",
    "adequacy_declaration_digest": "48f919d4a955be1746911bddc1e81050a76e183a26ad7162a68db0e936125261",
    "adequacy_result_digest": "97bef16d6e36ab74abc178574b9d295f40b2b60e90e6fd98463a1791d4693e9b",
    "executable_control_count": 95,
    "negative_fixture_count": 261,
    "coverage_witness_count": 261
  }
}
